<?xml version="1.0"?>
<!DOCTYPE database SYSTEM "litesql.dtd"> 
<database name="ExampleDatabase" namespace="example">
  <include name="auth.xml" />
    <object name="Person">
        <field name="name" type="string"/>
        <field name="age" type="integer" default="15"/>
      <field name="image" type="blob"/>
      <field name="aDoubleValue" type="double"/>
      <field name="sex" type="integer">
            <value name="Male" value="0"/>
            <value name="Female" value="1"/>
        </field>
        <method name="sayHello"/>
      <index unique="true">
        <indexfield name="name"/>
        <indexfield name="age"/>
      </index>

    </object>
    <relation id="Mother" unidir="true">
        <relate object="Person" limit="many" handle="mother"/>
        <relate object="Person" limit="one"/>
    </relation>
    <relation id="Father" unidir="true">
        <relate object="Person" limit="many" handle="father"/>
        <relate object="Person" limit="one"/>
    </relation>
    <relation id="Siblings">
        <relate object="Person" handle="siblings"/>
        <relate object="Person"/>
    </relation>
    <relation id="Children" unidir="true">
        <relate object="Person" handle="children"/>
        <relate object="Person"/>
    </relation>
    <object name="Role"/>
    <object name="Student" inherits="Role"/>
    <object name="Employee" inherits="Role"/>
    <relation id="Roles" name="RoleRelation">
        <relate object="Person" handle="roles" limit="one"/>
        <relate object="Role" handle="person"/>
    </relation>
    <object name="School">
        <field name="name" type="string"/>
    </object>
    <relation>
        <relate object="Student" handle="school"/>
        <relate object="School" handle="students" limit="one"/>
        
    </relation>
    <object name="Office"/>
    <relation>
        <relate object="Employee" handle="office"/>
        <relate object="Office" handle="employees"/>
    </relation>
  <object name="ThingWithMethods">
    <method name="sayHello">
      <param type="string" name="text" />
      <param type="int" name="repeat" />

    </method>  

  </object>
</database>
